Running as user "root" and group "root". This could be dangerous.
Capturing on 'Loopback: lo'
    1 0.000000000    127.0.0.1 → 127.0.1.1    TCP 74 45710 → 22 [SYN] Seq=0 Win=65495 Len=0 MSS=65495 SACK_PERM=1 TSval=2132059897 TSecr=0 WS=128
    2 0.000012203    127.0.1.1 → 127.0.0.1    TCP 74 22 → 45710 [SYN, ACK] Seq=0 Ack=1 Win=65483 Len=0 MSS=65495 SACK_PERM=1 TSval=894965240 TSecr=2132059897 WS=128
    3 0.000019807    127.0.0.1 → 127.0.1.1    TCP 66 45710 → 22 [ACK] Seq=1 Ack=1 Win=65536 Len=0 TSval=2132059897 TSecr=894965240
    4 0.000097302    127.0.0.1 → 127.0.1.1    SSH 89 Client: Protocol (SSH-2.0-libssh2_1.8.0)
    5 0.000101059    127.0.1.1 → 127.0.0.1    TCP 66 22 → 45710 [ACK] Seq=1 Ack=24 Win=65536 Len=0 TSval=894965240 TSecr=2132059897
    6 0.005536569    127.0.1.1 → 127.0.0.1    SSHv2 107 Server: Protocol (SSH-2.0-OpenSSH_8.2p1 Ubuntu-4ubuntu0.5)
    7 0.005559372    127.0.0.1 → 127.0.1.1    TCP 66 45710 → 22 [ACK] Seq=24 Ack=42 Win=65536 Len=0 TSval=2132059903 TSecr=894965246
    8 0.006638876    127.0.0.1 → 127.0.1.1    SSHv2 810 Client: Key Exchange Init
    9 0.006648053    127.0.1.1 → 127.0.0.1    TCP 66 22 → 45710 [ACK] Seq=42 Ack=768 Win=64896 Len=0 TSval=894965247 TSecr=2132059904
   10 0.006878265    127.0.1.1 → 127.0.0.1    SSHv2 1122 Server: Key Exchange Init
   11 0.006886250    127.0.0.1 → 127.0.1.1    TCP 66 45710 → 22 [ACK] Seq=768 Ack=1098 Win=64512 Len=0 TSval=2132059904 TSecr=894965247
   12 0.006967863    127.0.0.1 → 127.0.1.1    SSHv2 90 Client: Diffie-Hellman Group Exchange Request
   13 0.006976940    127.0.1.1 → 127.0.0.1    TCP 66 22 → 45710 [ACK] Seq=1098 Ack=792 Win=64896 Len=0 TSval=894965247 TSecr=2132059904
   14 0.010167080    127.0.1.1 → 127.0.0.1    SSHv2 346 Server: Diffie-Hellman Group Exchange Group
   15 0.010206504    127.0.0.1 → 127.0.1.1    TCP 66 45710 → 22 [ACK] Seq=792 Ack=1378 Win=65280 Len=0 TSval=2132059908 TSecr=894965250
   16 0.016439459    127.0.0.1 → 127.0.1.1    SSHv2 338 Client: Diffie-Hellman Group Exchange Init
   17 0.016475887    127.0.1.1 → 127.0.0.1    TCP 66 22 → 45710 [ACK] Seq=1378 Ack=1064 Win=65280 Len=0 TSval=894965257 TSecr=2132059914
   18 0.020281426    127.0.1.1 → 127.0.0.1    SSHv2 1170 Server: Diffie-Hellman Group Exchange Reply, New Keys
   19 0.020338493    127.0.0.1 → 127.0.1.1    TCP 66 45710 → 22 [ACK] Seq=1064 Ack=2482 Win=64512 Len=0 TSval=2132059918 TSecr=894965261
   20 0.028281669    127.0.0.1 → 127.0.1.1    SSHv2 82 Client: New Keys
   21 0.028332985    127.0.1.1 → 127.0.0.1    TCP 66 22 → 45710 [ACK] Seq=2482 Ack=1080 Win=65536 Len=0 TSval=894965269 TSecr=2132059926
   22 0.028506681    127.0.0.1 → 127.0.1.1    SSHv2 130 Client: Encrypted packet (len=64)
   23 0.028509286    127.0.1.1 → 127.0.0.1    TCP 66 22 → 45710 [ACK] Seq=2482 Ack=1144 Win=65536 Len=0 TSval=894965269 TSecr=2132059926
   24 0.028595312    127.0.1.1 → 127.0.0.1    SSHv2 130 Server: Encrypted packet (len=64)
   25 0.028602625    127.0.0.1 → 127.0.1.1    TCP 66 45710 → 22 [ACK] Seq=1144 Ack=2546 Win=65536 Len=0 TSval=2132059926 TSecr=894965269
   26 1.524257046    127.0.0.1 → 127.0.1.1    SSHv2 146 Client: Encrypted packet (len=80)
   27 1.524290248    127.0.1.1 → 127.0.0.1    TCP 66 22 → 45710 [ACK] Seq=2546 Ack=1224 Win=65536 Len=0 TSval=894966765 TSecr=2132061422
   28 1.531695495    127.0.1.1 → 127.0.0.1    SSHv2 146 Server: Encrypted packet (len=80)
   29 1.531704903    127.0.0.1 → 127.0.1.1    TCP 66 45710 → 22 [ACK] Seq=1224 Ack=2626 Win=65536 Len=0 TSval=2132061429 TSecr=894966772
   30 1.531969274    127.0.0.1 → 127.0.1.1    SSHv2 146 Client: Encrypted packet (len=80)
   31 1.531979563    127.0.1.1 → 127.0.0.1    TCP 66 22 → 45710 [ACK] Seq=2626 Ack=1304 Win=65536 Len=0 TSval=894966772 TSecr=2132061429
   32 1.532038223    127.0.0.1 → 127.0.1.1    TCP 66 45710 → 22 [FIN, ACK] Seq=1304 Ack=2626 Win=65536 Len=0 TSval=2132061429 TSecr=894966772
   33 1.533397652    127.0.1.1 → 127.0.0.1    TCP 66 22 → 45710 [FIN, ACK] Seq=2626 Ack=1305 Win=65536 Len=0 TSval=894966774 TSecr=2132061429
   34 1.533415024    127.0.0.1 → 127.0.1.1    TCP 66 434 packets captured
5710 → 22 [ACK] Seq=1305 Ack=2627 Win=65536 Len=0 TSval=2132061431 TSecr=894966774
